<?xml version="1.0" encoding="UTF-8" standalone="yes"?>
<GSKDocument xmlns:xsi="http://www.w3.org/2001/XMLSchema-instance" DtdVersion="1" DtdRelease="0" xsi:noNamespaceSchemaLocation="gsk-document.xsd">
	<DocumentIdentification v="17XTSO-CS------W-20160729-F112"/>
	<DocumentVersion v="1"/>
	<DocumentType v="Z02"/>
	<ProcessType v="Z02"/>
	<SenderIdentification v="XXXXXXXXXXXXX" codingScheme="A01"/>
	<SenderRole v="A36"/>
	<ReceiverIdentification v="YYYYYYYYYY" codingScheme="A01"/>
	<ReceiverRole v="A04"/>
	<CreationDateTime v="2017-10-30T09:27:21Z"/>
	<GSKTimeInterval v="2016-07-28T22:00Z/2016-07-29T22:00Z"/>
	<Domain v="domain" codingScheme="A01"/>
	<GSKSeries>
		<TimeSeriesIdentification v="5"/>
		<BusinessType v="Z02" share="10"/>
		<Area v="area3" codingScheme="A01"/>
	</GSKSeries>
	<GSKSeries>
		<TimeSeriesIdentification v="3"/>
		<BusinessType v="Z05" share="70"/>
		<Area v="area1" codingScheme="A01"/>
		<AutoGSK_Block>
			<GSK_Name v="FR"/>
			<TimeInterval v="2016-07-28T22:00Z/2016-07-29T22:00Z"/>
			<AutoNodes>
				<NodeName v="FFR2AA2 "/>
			</AutoNodes>
		</AutoGSK_Block>
	</GSKSeries>
	<GSKSeries>
		<TimeSeriesIdentification v="4"/>
		<BusinessType v="Z02" share="100"/>
		<Area v="area2" codingScheme="A01"/>
		<AutoGSK_Block>
			<GSK_Name v="name2"/>
			<TimeInterval v="2016-07-28T22:00Z/2016-07-28T23:00Z"/>
			<AutoNodes>
				<NodeName v="XXF1AA1 "/>
			</AutoNodes>
		</AutoGSK_Block>
		<AutoGSK_Block>
			<GSK_Name v="name2"/>
			<TimeInterval v="2016-07-28T23:00Z/2016-07-29T22:00Z"/>
			<AutoNodes>
				<NodeName v="XXF1AA1 "/>
			</AutoNodes>
			<AutoNodes>
				<NodeName v="XXF1AA2 "/>
			</AutoNodes>
		</AutoGSK_Block>
	</GSKSeries>
</GSKDocument>
